<?xml version="1.0" encoding="UTF-8"?>
<!DOCTYPE pr SYSTEM "../common/PR.dtd">
<pr>
    <metadata>
        <keyname></keyname>
        <title>TPC6</title>
        <supervisor homepage="www.di.uminho.pt/~jcr">José Carlos Ramalho</supervisor>
        <bdate>22/10/2019</bdate>
        <edate>28/10/2019</edate>
    </metadata>
    <workteam>
        <worker>
            <identifier>A81946</identifier>
            <name>Carlos Peixoto Antunes de Castro</name>
            <email>a81946@alunos.uminho.pt</email>
            <git>https://github.com/carlosc20</git>
        </worker>
    </workteam>
    <abstract>
        <p>Servidor em node.js usando a framework express que permite realizar operações CRUD sobre um ficheiro JSON que contém o Arquivo Sonoro de Ernesto Veiga de Oliveira.</p>
    </abstract>
    <deliverables>
        <deliverable path="tp6">Diretoria do servidor node.js</deliverable>
    </deliverables>
</pr>